{
  "schema_version": "1.0",
  "tenant_id": "00000000-0000-0000-0000-000000000001",
  "site_id": "00000000-0000-0000-0000-000000000002",
  "device_id": "00000000-0000-0000-0000-000000000003",
  "activated": true,
  "certified_models": [
    {
      "brand": "deye",
      "model": "SUN-30K-SG01HP3-EU",
      "family": "hybrid_3p",
      "control_path": "remote",
      "invert_control_sign": false,
      "certified_at": "2026-07-27T14:05:00Z",
      "firmware_note": "Protokoll V105.1, Remote-Register 1100-1121 vorhanden",
      "note": "Pruefstand Pilsting: Vorzeichen und Skala bestaetigt"
    }
  ],
  "published_at": "2026-08-10T09:00:00Z"
}
